BillID,Type,Title,Status,Summary,Category_Label
118-hr128,hr,Defund Planned Parenthood Act of 2023,Referred to the Subcommittee on Health.," <p><b>Defund Planned Parenthood Act of </b><b>2023</b></p> <p>This bill restricts federal funding for Planned Parenthood Federation of America Inc. or any of its affiliates or clinics for one year.</p> <p>Specifically, it prohibits funding those entities unless they certify that the affiliates and clinics will not perform, and will not provide funds to entities that perform, abortions during that year. If the certification requirement is not met, the Department of Health and Human Services and the Department of Agriculture must recoup any federal assistance received by those entities.</p> <p>However, the bill's funding restriction does not apply to abortions performed in cases of rape or incest or when necessary to resolve a physical condition that endangers a woman's life.</p> <p>The bill also provides additional funding for community health centers for the one-year period. These funds are subject to the same abortion-related restrictions and exceptions.</p>",0
118-hr165,hr,New Source Review Permitting Improvement Act,"Referred to the Subcommittee on Environment, Manufacturing, and Critical Materials."," <p><b>New Source Review Permitting Improvement Act</b> </p> <p>This bill modifies terminology for purposes of the New Source Review (NSR) permitting program of the Environmental Protection Agency (EPA).</p> <p>In order for a change to a stationary source to be a <i>modification</i> (a change to a stationary source that increases the air pollutant emissions or results in new pollutants) for purposes of the NSR permitting program, the maximum hourly emission rate achievable by such source must be higher than the maximum hourly rate achievable by such source during any hour in the 10-year period preceding the change.</p> <p>A change at a stationary source is not considered to be a <i>modification</i> under the bill if it is designed to (1) reduce the amount of any air pollutant emitted; or (2) restore, maintain, or improve the reliability of operations at, or safety of, the source. However, such changes are not excepted if the EPA determines the increase in the maximum achievable hourly emission rate from such change would cause an adverse effect on human health or the environment.</p> <p><i>Construction</i>, in connection with a major emitting facility (a type of stationary source), does not include a change at such a facility that does not result in a significant emissions increase or a significant net emissions increase.</p> <p>In relation to major emitting facilities in nonattainment areas, the terms <i>modifications </i>and <i>modified</i> do not include changes at such facilities that do not result in a significant emissions increase or a significant net emissions increase.</p>",2
118-hr170,hr,Domestic SUPPLY Act of 2023,Referred to the Subcommittee on Health.," <p><strong>Domestic Security Using Production Partnerships and Lessons from Yesterday Act of 2023 or the Domestic SUPPLY Act of 2023</strong></p> <p>This bill establishes a program and sets out other requirements to promote domestic manufacturing of personal protective equipment (PPE) for infectious diseases and other public health emergencies.</p> <p>The Department of Health and Human Services (HHS) must establish a program to enter into purchasing agreements for PPE produced domestically by manufacturers that are majority-owned and -operated by U.S. citizens. HHS must coordinate with the Department of Defense and the Department of Homeland Security on this program.</p> <p>In addition, the federal government must only procure, subject to limited exceptions, PPE that is produced domestically to prevent the transmission of an infectious disease. If using federal funds, states or localities must also procure PPE domestically.</p> <p>Further, the bill requires HHS to consult with the Occupational Safety and Health Administration on a report about changes to federal requirements for PPE during the COVID-19 pandemic and the impact of those changes on health care workers who cared for patients in 2020 and 2021.</p>",0
118-hr180,hr,To promote accountability and transparency in future executive orders.,"Referred to the Subcommittee on Energy, Climate and Grid Security.", <p>This bill requires the President to notify Congress and the public before issuing executive orders relating to energy policy.</p>,4
118-hr206,hr,Healthy Technology Act of 2023,Referred to the Subcommittee on Health.," <p><strong>Healthy Technology Act of 2023 </strong></p> <p>This bill establishes that artificial intelligence (AI) or machine learning technology may be eligible to prescribe drugs.</p> <p>Currently, certain drugs may be dispensed only upon a prescription provided by a practitioner licensed by law to administer the drug. Under this bill, an AI or machine learning technology may qualify as such a prescribing practitioner if the technology is (1) authorized by state law to prescribe the drug involved; and (2) approved, cleared, or authorized under certain federal provisions pertaining to medical devices and products.</p>",2
118-hr222,hr,No Oil for CCP Act,"Referred to the Subcommittee on Energy, Climate and Grid Security."," <p><b>No Oil for CCP Act</b></p> <p>This bill bans exports of crude oil from the Strategic Petroleum Reserve (SPR) to China, North Korea, Iran, and other specified recipients. Specifically, the bill directs the Department of Energy to require as a condition of any sale of crude oil from the SPR that (1) the oil not be exported to such countries; and (2) the recipient of the oil is not under the ownership, control, or influence of the Chinese Communist Party.</p>",0
118-hr223,hr,Adoption Information Act,Referred to the Subcommittee on Health., <p><b>Adoption Information Act</b></p> <p>This bill requires federally funded family planning programs to provide each person who inquires about their services with specified information about adoption centers in their state. The Department of Health and Human Services must provide the programs with pamphlets containing the required information.</p>,0
118-hr229,hr,World Deserves To Know Act,Referred to the Subcommittee on Health.," <p><strong>World Deserves To Know Act</strong></p> <p>This bill requires sanctions on certain members of the Chinese Communist Party (CCP) and officials of Chinese health agencies. It also addresses related issues.</p> <p>The President must impose visa- and property-blocking sanctions on any foreign person who is a CCP official and who is knowingly responsible for or complicit in (1) the disappearances of whistleblowers and citizen journalists in China relating to COVID-19, or (2) limiting free speech and academic freedom in China relating to COVID-19. </p> <p>The President must also impose such sanctions on specified individuals who have leadership positions in China's Center for Disease Control and Prevention and China's National Health Commission (NHC).</p> <p>The authority to impose such sanctions shall end when the President certifies to Congress that an independent and unimpeded investigation into the potential origin of COVID-19 from the Wuhan Institute of Virology has taken place.</p> <p>The bill also bars federal funds and certain federal student assistance from going to institutions of higher education that enter into a contract with any element or China-based affiliate of the NHC.</p> <p>Federal funding to the National Academy of Sciences may not be used to enter into a contract with any element or China-based affiliate of the NHC.</p> <p>The Government Accountability Office must report to Congress a review of all funds that the National Institutes of Health have made available to the NHC since FY2010. This report must also be publicly available.</p>",0
118-hr124,hr,Byron Nash Renal Medullary Carcinoma Awareness Act of 2023,Referred to the Subcommittee on Health., <p><strong>Byron Nash Renal Medullary Carcinoma Awareness Act of </strong><b>2023</b></p> <p>This bill allows states to receive federal payment under Medicaid for 50% of their costs for providing education on the risk of renal medullary carcinoma to individuals with sickle cell disease. (Renal medullary carcinoma is a rare kidney disease usually found in individuals with the sickle cell trait.) </p>,0
118-hr120,hr,Improving Science in Chemical Assessments Act,"Referred to the Subcommittee on Environment, Manufacturing, and Critical Materials."," <p><b>Improving Science in Chemical Assessments Act</b></p> <p>This bill modifies procedures related to specified chemical assessments performed by the Environmental Protection Agency (EPA). Specifically, chemical hazard identification and dose response assessments must be performed by the appropriate EPA program office (they are currently performed by the Integrated Risk Information System program).</p> <p>Additionally, the bill requires the EPA to establish a steering committee to ensure there is no duplication of effort by relevant program offices in conducting covered assessments.</p>",0
118-hconres3,hconres,"Expressing the sense of Congress condemning the recent attacks on pro-life facilities, groups, and churches.",Received in the Senate and referred to the Committee on the Judiciary.," <p>This concurrent resolution condemns recent attacks on pro-life facilities, groups, and churches and calls on the current presidential administration to use appropriate law enforcement authorities to support their safety.</p>",1
118-hconres1,hconres,Regarding consent to assemble outside the seat of government.,Received in the Senate., <p>This concurrent resolution authorizes the Speaker of the House and the Majority Leader of the Senate to assemble the House and the Senate outside the District of Columbia whenever the public interest warrants it.</p>,3
118-hr175,hr,Heartbeat Protection Act of 2023,Sponsor introductory remarks on measure. (CR H271-272)," <p><b>Heartbeat Protection Act of 2023</b></p> <p>This bill makes it a crime for a physician to knowingly perform an abortion (1) without determining whether the unborn child has a detectable heartbeat, (2) without informing the mother of the results, or (3) after determining that a unborn child has a detectable heartbeat.</p> <p>A physician who performs a prohibited abortion is subject to criminal penalties&#8212;a fine, up to five years in prison, or both.</p> <p>The bill provides an exception for an abortion that is necessary to save the life of a mother whose life is endangered by a physical (but not psychological or emotional) disorder, illness, or condition. It also provides exceptions for certain pregnancies that are the result of rape or incest. A physician who performs or attempts to perform an abortion under an exception must comply with specified requirements. </p> <p>A woman who undergoes a prohibited abortion may not be prosecuted for violating or conspiring to violate the provisions of this bill.</p>",2
118-hr159,hr,Chance to Compete Act of 2023,Received in the Senate and Read twice and referred to the Committee on Homeland Security and Governmental Affairs.," <p><b>Chance to Compete Act of 2023</b></p> <p>This bill modifies examination requirements and other components of the federal hiring process for positions in the competitive service.</p> <p>Specifically, the bill provides that a qualifying examination includes a r&eacute;sum&eacute; review that is conducted by a subject matter expert. Additionally, beginning two years after the bill's enactment, the bill prohibits examinations from consisting solely of a self-assessment from an automated examination, a r&eacute;sum&eacute; review that is not conducted by a subject matter expert, or any other method of assessing an applicant's experience or education; an agency may waive these requirements when necessary but must report any such waivers and may not use waivers to fill more than 10% of agency positions.</p> <p>Agencies may use subject matter experts to develop position-specific technical assessments that allow applicants to demonstrate job-related skills, abilities, and knowledge; assessments may include structured interviews, work-related exercises, procedures to measure career-related qualifications and interests, or other similar assessments. The bill also allows agencies to establish talent teams to support and improve hiring practices.</p> <p>The Office of Personnel Management (OPM) must create online platforms through which agencies may share and customize technical assessments and share the r&eacute;sum&eacute;s of qualifying applicants. The OPM must also create online platforms with information about (1) the types of assessments used and hiring outcomes, (2) educational requirements for certain positions and related justifications, and (3) authorities and programs that support agency recruitment and retention.</p>",0
118-hr22,hr,Protecting America’s Strategic Petroleum Reserve from China Act,Read the second time. Placed on Senate Legislative Calendar under General Orders. Calendar No. 4.," <p><b>Protecting America's Strategic Petroleum Reserve from China Act</b></p> <p>This bill prohibits the sale and export of crude oil from the Strategic Petroleum Reserve (SPR) to China. Specifically, the bill prohibits the Department of Energy (DOE) from selling petroleum products (e.g., crude oil) from the SPR to any entity that is under the ownership, control, or influence of the Chinese Communist Party. Further, DOE must require as a condition of any sale of crude oil from the SPR that the oil not be exported to China.</p>",0
118-hr23,hr,Family and Small Business Taxpayer Protection Act,Read the second time. Placed on Senate Legislative Calendar under General Orders. Calendar No. 1., <p> <strong>Family and Small Business Taxpayer Protection Act </strong></p> <p>This bill rescinds certain unobligated amounts made available to the Internal Revenue Service by the Inflation Reduction Act of 2022 for its enforcement activities and for funding certain Department of the Treasury tax agencies.</p>,2
118-hr26,hr,Born-Alive Abortion Survivors Protection Act,Read the second time. Placed on Senate Legislative Calendar under General Orders. Calendar No. 2.," <p><b>Born-Alive Abortion Survivors Protection Act</b> <p>This bill establishes requirements for the degree of care a health care practitioner must provide in the case of a child born alive following an abortion or attempted abortion.</p> <p> Specifically, a health care practitioner who is present must (1) exercise the same degree of care as would reasonably be provided to any other child born alive at the same gestational age, and (2) ensure the child is immediately admitted to a hospital. Additionally, a health care practitioner or other employee who has knowledge of a failure to comply with the degree-of-care requirements must immediately report such failure to law enforcement.</p> <p>A health care practitioner who fails to provide the required degree of care, or a health care practitioner or other employee who fails to report such failure, is subject to criminal penalties&#8212;a fine, up to five years in prison, or both. </p> <p> An individual who intentionally kills or attempts to kill a child born alive is subject to prosecution for murder.</p> <p>The bill bars the criminal prosecution of a mother of a child born alive under this bill and allows her to bring a civil action against a health care practitioner or other employee for violations. </p>",0
118-hconres7,hconres,Condemning the Iranian regime's human rights abuses  against the brave women and men of Iran peacefully demonstrating in more than 133 cities.,Received in the Senate and referred to the Committee on Foreign Relations.," <p>This concurrent resolution commends the bravery, courage, and resolve of the women and men of Iran who are (1) participating in the current protests to defend their fundamental human rights, and (2) risking their safety to speak out against the human rights abuses committed by the Iranian regime.</p> <p>The resolution condemns (1) the brutal beating and death of Mahsa Amini; and (2) the violent suppression by the Iranian regime of women and men participating in the current demonstrations, including children, and calls for transparent accountability for all killings of protesters by Iranian security forces.</p> <p>Finally, the resolution encourages continued efforts by the Biden Administration to respond to the protests, including the recent sanctioning of the Iranian morality police.</p>",1
118-hr30,hr,Stop Human Trafficking in School Zones Act,Sponsor introductory remarks on measure. (CR H507)," <p><b>Stop Human Trafficking in School Zones Act</b></p> <p>This bill establishes an enhanced penalty&#8212;an additional prison term of up to five years&#8212;for certain human trafficking offenses and sex offenses involving minors that occur within 1,000 feet of the real property comprising a school, school-sponsored activity, playground, or public housing facility; or within 100 feet of certain other places where children gather (e.g., a youth center or swimming pool). The additional prison term must be served consecutively with the prison term imposed for the underlying offense. </p>",0
118-hr21,hr,Strategic Production Response Act,Received in the Senate and Read twice and referred to the Committee on Energy and Natural Resources., <p><b>Strategic Production Response Act</b></p> <p>This bill limits the drawdown of petroleum in the Strategic Petroleum Reserve until the Department of Energy develops a plan to increase the percentage of federal lands leased for oil and gas production.</p>,0
118-hr132,hr,Protecting Local Communities from Harmful Algal Blooms Act,"Referred to the Subcommittee on Economic Development, Public Buildings, and Emergency Management.", <p><b>Protecting Local Communities from Harmful Algal Blooms Act</b></p> <p>This bill amends the Robert T. Stafford Disaster Relief and Emergency Assistance Act to include algal blooms in the definition of a <i>major disaster</i>.</p>,0
118-hres12,hres,Establishing a Select Subcommittee on the Weaponization of the Federal Government as a select investigative subcommittee of the Committee on the Judiciary.,"UNANIMOUS CONSENT - Mr. Franklin, C. Scott asked unanimous consent that, notwithstanding section 1(a)(2)(A) of House Resolution 12 (as amended by section 1(c) of House Resolution 78), and the order of the House of today, the Select Subcommittee on the Weaponization of the Federal Government be composed of not more than 21 Members, Delegates, or the Resident Commissioner appointed by the Speaker, of whom not more than 9 shall be appointed in consultation with the Minority Leader. Agreed to without objection."," <p>This resolution temporarily establishes in the House of Representatives the Select Subcommittee on the Weaponization of the Federal Government, which is comprised of not more than 13 Members appointed by the Speaker (5 of whom shall be appointed in consultation with the minority leader).</p> <p>The subcommittee must investigate matters related to the collection, analysis, dissemination, and use of information on U.S. citizens by executive branch agencies, including whether such efforts are illegal, unconstitutional, or otherwise unethical. The subcommittee must make a final report of its findings by January 2, 2025, and terminates 30 days after filing that report.</p>",3
118-hr103,hr,"To prohibit the Secretary of Transportation, acting through the Administrator of the Federal Aviation Administration, from setting a requirement that air carriers and foreign air carriers must require an individual to test negative for COVID-19 to travel in air transportation on an air carrier, and for other purposes.",Referred to the Subcommittee on Aviation., <p>This bill prohibits the Federal Aviation Administration from setting a requirement that air carriers and foreign air carriers must require a passenger to test negative for COVID-19 to travel domestically on such carriers.</p>,0
118-hr220,hr,Advanced Aviation Act,Referred to the Subcommittee on Aviation.," <p><b>Advanced Aviation Act</b></p> <p>This bill directs the Department of Transportation (DOT) to redesignate the Office of NextGen as the Office of Advanced Aviation within the Federal Aviation Administration (FAA). The new office duties include the coordination of rulemaking and approval processes on matters relating to advanced aviation systems (e.g., drones, supersonic aircraft technologies, counter-unmanned aircraft systems).</p> <p>The bill also establishes an Office of Advanced Integration within the Office of Advanced Aviation.</p> <p>Additionally, DOT must establish an Advanced Aviation Coordination Unit within the FAA whose responsibilities shall include the promotion of the safe and responsible integration of advanced aviation systems into the national airspace system.</p> <p>Further, DOT must redesignate the William J. Hughes Technical Center as the William J. Hughes Technical Center for Advanced Aviation. The center must establish and manage a program to evaluate new aviation-related technologies proposed to be used in the national airspace system and facilitate the integration of such technologies into the national airspace system.</p>",0
118-hr139,hr,SHOW UP Act of 2023,Received in the Senate and Read twice and referred to the Committee on Homeland Security and Governmental Affairs.," <p><b>Stopping Home Office Work's Unproductive Problems Act of 2023 or the SHOW UP Act of </b><b>2023</b></p> <p>This bill requires each executive agency to reinstate the telework policies that were in place on December 31, 2019. Agencies may not implement expanded telework policies unless the Office of Personnel Management certifies that such policies, among other requirements, will have a positive effect on the agency's mission and operational costs.</p>",2
118-hr29,hr,Border Safety and Security Act of 2023,Referred to the Subcommittee on Border Security and Enforcement.," <p><b>Border Safety and Security Act of 2023</b></p> <p>This bill requires the Department of Homeland Security (DHS) to suspend the entry of any non-U.S. nationals (<i>aliens</i> under federal law) without valid entry documents during any period when DHS cannot detain such an individual or return the individual to a foreign country contiguous to the United States. A state may sue DHS to enforce this requirement. </p> <p>(Under current law, non-U.S. nationals who arrive at the border without entry documents are generally subject to expedited removal. However, if such an individual is found to have a credible fear of persecution, they are typically subject to detention while their asylum claim is being considered.)</p> <p>The bill also authorizes DHS to suspend the entry of non-U.S. nationals without entry documents at the border if DHS determines that such a suspension is necessary to achieve operational control over such a border. </p>",1
118-hr191,hr,"To require the Secretary of Homeland Security to publish the number of known or suspected terrorists encountered attempting to enter the United States on a monthly basis, and for other purposes.","Referred to the Subcommittee on Oversight, Investigations, and Accountability."," <p>This bill directs the Department of Homeland Security to publish, by the 15th day of each month, the number of known or suspected terrorists, and individuals whose identities are included in the Terrorist Screening Database, encountered attempting to enter the United States during the immediately preceding month.</p>",0
118-hr58,hr,FIRST State and Local Law Enforcement Act of 2023,"Referred to the Subcommittee on Counterterrorism, Law Enforcement, and Intelligence.", <p><b>Federal Information Resource to Strengthen Ties with State and Local Law Enforcement Act of 2023 or the FIRST State and Local Law Enforcement Act of 2023</b></p> <p>This bill requires the Department of Homeland Security's Office for State and Local Law Enforcement to report annually on its activities.</p>,1
118-hr163,hr,Security First Act,Referred to the Subcommittee on Border Security and Enforcement.," <p><b>Security First Act</b></p> <p>This bill reauthorizes the Operation Stonegarden program from FY2024 through FY2027 and addresses other border security issues. (Operation Stonegarden provides grants to enhance the border security capabilities of state, local, and tribal governments.)</p> <p>From FY2024 through FY2027, the money from unreported monetary instruments seized from individuals crossing the U.S.-Mexico border and transferred into the Department of the Treasury general fund shall be made available without further appropriation to the Department of Homeland Security (DHS) to fund Operation Stonegarden. </p> <p>DHS must report to Congress on (1) DHS hiring practices from 2018 to 2021, and (2) whether certain Mexican drug cartels meet the criteria to be designated as foreign terrorist organizations. DHS must also periodically report to Congress about the technology needed to secure the U.S.-Mexico land border.</p>",2
