BillID,Type,Title,Status,Summary,Category_Label
118-hr44,hr,Kalief’s Law,Referred to the House Committee on the Judiciary.," <p><strong></strong><b>Effective and Humane Treatment of Youth Act of 2023 or Kalief's Law </b></p> <p>This bill establishes requirements for the treatment of youth in the criminal justice system at the federal, state, and local levels. A <em>youth</em> is an individual who is 21 years of age or younger.</p> <p>At the federal level, the bill </p> <ul> <li>requires federal law enforcement officers to record youth custodial interrogations,</li> <li>limits the use of solitary confinement for youth at federal facilities, and </li> <li>limits the use of restraints on youth during federal court proceedings.</li> </ul> <p>At the state and local levels, the bill places conditions on existing grants and establishes a new grant to incentivize the implementation of similar policies with respect to youth. </p> <p>First, the bill reauthorizes the Juvenile Accountability Block Grant program for FY2023-FY2027. To be eligible for grant funds, state and local governments must implement policies that, with respect to youth, provide a right to speedy trial, provide a right to timely bail consideration, and restrict the use of solitary confinement.</p> <p>Second, a state or local government that receives funding under the Edward Byrne Memorial Justice Assistance Grant program or the Community Oriented Policing Services program must implement policies and training on police-youth interaction. </p> <p>Third, the bill directs the Department of Justice to award grants to help state and local governments record youth custodial interrogations.</p>",0
118-hr46,hr,Mental Health Access and Gun Violence Prevention Act of 2023,"Referred to the Committee on Energy and Commerce, and in addition to the Committee on the Judiciary, for a period to be subsequently determined by the Speaker, in each case for consideration of such provisions as fall within the jurisdiction of the committee concerned."," <p><b>Mental Health Access and Gun Violence Prevention Act of </b><b>2023</b></p> <p>This bill authorizes FY2024 appropriations for the Department of Justice, the Department of Health and Human Services, and the Social Security Administration to (1) increase access to mental health care treatment and services, and (2) promote reporting of mental health information to the National Instant Criminal Background Check System. (This system is used to query federal, state, local, tribal, and territorial criminal history record information and other records to determine an individual's eligibility to receive, transfer, or possess firearms.)</p>",0
118-hr48,hr,Gun Violence Reduction Resources Act of 2023,Referred to the House Committee on the Judiciary.," <p><b>Gun Violence Reduction Resources Act of 2023</b></p> <p>This bill authorizes the Department of Justice to hire 200 additional agents and investigators for the Bureau of Alcohol, Tobacco, Firearms and Explosives.</p>",0
118-hr50,hr,Terry Technical Correction Act,Referred to the House Committee on the Judiciary.," <p><b>Terry Technical Correction Act</b></p> <p>This bill broadens the scope of crack cocaine offenders who are eligible for a retroactive sentencing reduction under the First Step Act of 2018.</p> <p>The First Step Act made the Fair Sentencing Act of 2010 retroactive and authorized sentencing reductions for certain crack cocaine offenders convicted and sentenced before the Fair Sentencing Act became effective. Under current law, crack cocaine offenders whose conduct triggered a mandatory minimum sentence are eligible for a retroactive sentencing reduction under the First Step Act. However, in 2021, the Supreme Court held in <i>Terry v. United States</i> that low-level crack cocaine offenders whose conduct did not trigger a mandatory minimum sentence are not eligible for a retroactive sentencing reduction under the First Step Act.</p> <p>This bill extends eligibility for a retroactive sentencing reduction under the First Step Act to all crack cocaine offenders convicted and sentenced before the Fair Sentencing Act became effective, including low-level offenders whose conduct did not trigger a mandatory minimum sentence. </p>",2
118-hr52,hr,Kimberly Vaughan Firearm Safe Storage Act,"Referred to the Committee on the Judiciary, and in addition to the Committee on Ways and Means, for a period to be subsequently determined by the Speaker, in each case for consideration of such provisions as fall within the jurisdiction of the committee concerned."," <p><strong>Kimberly Vaughan Firearm Safe Storage Act</strong></p> <p>This bill directs the Department of Justice (DOJ) to establish voluntary best practices for safe firearm storage solely for the purpose of public education. DOJ must give at least 90 days public notice and afford an opportunity for a hearing before establishing such best practices.</p> <p>The bill authorizes DOJ to award grants for the development, implementation, and evaluation of Safe Firearm Storage Assistance Programs. </p> <p>The bill also provides for a new tax credit through 2030 for 10% of amounts received from the retail sale of a safe firearm storage device for use in the United States.</p>",0
118-hr54,hr,Federal Prison Bureau Nonviolent Offender Relief Act of 2023,Referred to the House Committee on the Judiciary.," <p><b>Federal Prison Bureau Nonviolent Offender Relief Act of 2023</b> <p>This bill establishes a new early release option for certain federal prisoners. </p> <p>Specifically, the Bureau of Prisons must release early an offender who has completed at least half of his or her sentence if such offender has attained age 45, has never been convicted of a crime of violence, and has not received any institutional disciplinary violations.",0
118-hr55,hr,Preventing Vigilante Stalking that Stops Women’s Access to Healthcare and Abortion Rights Act of 2022,Referred to the House Committee on the Judiciary.," <p><strong></strong><b>Preventing Vigilante Stalking that Stops Women's Access to Healthcare and Abortion Rights Act of 2022</b></p> <p>This bill increases the maximum prison term for a stalking offense, if the offense is committed with the intent to obtain an individual's health care information or prevent an individual's health care decisions.</p>",1
118-hr56,hr,RAISE Act of 2023,Referred to the House Committee on the Judiciary.," <p><b>Reforming Alternatives to Incarceration and Sentencing to Establish a Better Path for Youth Act of 2023 or the RAISE Act of 2023</b></p> <p>This bill modifies requirements and procedures related to the sentencing, confinement, and release of youth who are involved in the federal criminal justice system. The term <em>youth</em> means an individual who is prosecuted or sentenced for a criminal offense committed at age 21 or younger.</p> <p>The bill modifies federal sentencing options for youth, including by allowing courts </p> <ul> <li>to depart from the statutory mandatory minimum for certain nonviolent offenses, </li> <li>to reduce the prison term of a youth who has completed 20 years of the sentence, and </li> <li>to treat as discretionary a sentence of imprisonment for life. </li> </ul> <p>Additionally, it requires the Bureau of Prisons to separately designate youth correctional facilities, minimize contact between youth and other offenders, and establish programs regarding youth education, skills training, reentry, and mental and emotional health.</p> <p>Finally, the bill promotes reentry and reintegration into the community, including by</p> <ul> <li>providing an early release option for youth offenders who complete one half or more of their prison term and meet certain criteria; </li> <li>authorizing home confinement for a longer period of time; </li> <li>limiting the maximum prison term for technical violations of probation; </li> <li>establishing pilot programs for mentorship, government service, and animal service; and </li> <li>establishing pilot programs for diversion of high-risk, victimized, and primary caretaker youth. </li> </ul>",0
118-hr57,hr,Protecting Personal Data from Foreign Adversaries Act,"Referred to the Committee on Foreign Affairs, and in addition to the Committee on the Judiciary, for a period to be subsequently determined by the Speaker, in each case for consideration of such provisions as fall within the jurisdiction of the committee concerned."," <p><strong>Protecting Personal Data from Foreign Adversaries Act</strong></p> <p>This bill authorizes sanctions and other prohibitions relating to software that engages in user data theft on behalf of certain foreign countries or entities. </p> <p>The President may regulate or prohibit transactions using software that engages in the theft or unauthorized transmission of user data and provides access to such data to (1) a communist country, (2) the Chinese Communist Party (CCP), (3) a foreign adversary, or (4) a state sponsor of terrorism. </p> <p>The President may also impose visa- and property-blocking sanctions on developers and owners of software that makes unauthorized transmissions of user data to servers located in China that are accessible by China's government or the CCP.</p> <p>The Department of State shall report to Congress a determination regarding whether WeChat or TikTok fall within certain regulations and prohibitions, including those provided under this bill. (WeChat and TikTok are software programs developed by China-based companies.)</p>",0
118-hr60,hr,Accidental Firearms Transfers Reporting Act of 2023,Referred to the House Committee on the Judiciary.," <p><b>Accidental Firearms Transfers Reporting Act of 2023 </b></p> <p>This bill requires the Federal Bureau of Investigation (FBI) to report to Congress on the number of firearm transfers where (1) a licensed gun dealer submits a background check through the National Instant Criminal Background Check System (NICS), (2) NICS fails to respond within three business days, and (3) the licensed gun dealer completes the transfer.</p> <p>The FBI must also report on the procedures followed once the transferee is discovered to be ineligible. </p>",2
118-hr61,hr,Leading Against White Supremacy Act of 2023,Referred to the House Committee on the Judiciary.," <p><b>Leading Against White Supremacy Act of 2023</b></p> <p>This bill expands federal hate crime offenses to include acts motivated by white supremacy.</p> <p>The bill also establishes a standard for determining whether a person engaged in a white supremacy inspired hate crime, sets forth the elements of related conspiracies, and authorizes the Department of Justice to investigate, prosecute, and maintain records of white supremacy inspired hate crimes and related conspiracies.</p>",0
118-hr62,hr,SHIELD Act,"Referred to the Committee on Energy and Commerce, and in addition to the Committee on the Judiciary, for a period to be subsequently determined by the Speaker, in each case for consideration of such provisions as fall within the jurisdiction of the committee concerned."," <p><b>Safeguard Healthcare Industry Employees from Litigation and Distress Act or the SHIELD Act</b></p> <p>This bill establishes a framework to limit interference with persons seeking to provide or access reproductive health services at the state level. </p> <p>For the purposes of this summary, interference with persons seeking to provide or access reproductive health services includes acts to prevent, restrict, impede, or retaliate against</p> <ul> <li>a health care provider who provides reproductive health care services,</li> <li>any person or entity who helps health care providers to provide such services, </li> <li>any person who seeks to access such services, or </li> <li>any person or entity who helps another person to access such services.</li> </ul> <p>First, the bill reduces the allocation of funds under certain law enforcement grant programs for a state that has in effect a law authorizing state or local officers or employees to interfere with persons seeking to provide or access reproductive health services.</p> <p>Second, the bill prohibits interference with persons seeking to provide or access reproductive health care services</p> <ul> <li>by state or local officers or employees acting under color of law in any manner that would have a discriminatory effect on a woman, and </li> <li>by persons who are not state or local officers or employees and are attempting to implement or enforce a state law in circumstances affecting interstate commerce. </li> </ul> <p>The bill authorizes civil remedies for a violation, including damages and injunctive relief. Additionally, it authorizes criminal penalties for a violation involving the use of a deadly or dangerous weapon or the infliction of bodily injury.</p>",0
118-hr63,hr,GRACE Act,Referred to the House Committee on the Judiciary.," <p><b>Grant Relief for American Children's Elevation Act of 2023 or the GRACE Act</b></p> <p>This bill establishes that an <i>exceptional and extremely unusual hardship</i> includes a hardship resulting from a removal (or deportation) that separates the individual subject to removal from a family member who is a U.S. citizen, a lawful permanent resident, or lawfully admitted into the United States.</p> <p>Under current law, the Department of Homeland Security may cancel the removal of a non-U.S. national (<i>alien</i> under federal law) if the removal would result in an exceptional and extremely unusual hardship to an immediate relative who is a U.S. citizen or lawful permanent resident.</p>",2
118-hr64,hr,David’s Law,Referred to the House Committee on the Judiciary.," <p><strong></strong><b>David Ray Hate Crimes Prevention Act of 2022</b> <strong>or David&rsquo;s Law</strong></p> <p>This bill adds hate crime offenses and penalties to the criminal civil rights statute that prohibits interference with federally protected activities. Current law already prohibits and penalizes similar offenses under the criminal civil rights statute that prohibits hate crime offenses. </p> <p>Additionally, the bill authorizes state and local grants to combat hate crimes committed by juveniles. It also authorizes the Department of the Treasury and the Department of Justice to hire additional personnel to prevent and respond to alleged criminal civil rights offenses involving interference with federally protected activities.</p> <p>Finally, the bill directs the U.S. Sentencing Commission to study whether it is appropriate to provide a sentencing enhancement for adult defendants who recruit minors to commit hate crime offenses.</p>",1
118-hr135,hr,No Pay Raise for Congress Act,"Referred to the Committee on House Administration, and in addition to the Committee on Oversight and Accountability, for a period to be subsequently determined by the Speaker, in each case for consideration of such provisions as fall within the jurisdiction of the committee concerned.", <p><b>No Pay Raise for Congress Act</b></p> <p>This bill cancels the automatic adjustment to the pay of Members of Congress that is based on the employment cost index if the Congressional Budget Office determines that there was a federal budget deficit in the last fiscal year.</p>,4
118-hr136,hr,HELD Act,Referred to the House Committee on the Judiciary.," <p><b>Help Ensure Legal Detainers Act or the HELD Act</b></p> <p>This bill prohibits the use of federal funds by a state or local subdivision that has in effect a law, policy, or procedure that prevents or impedes </p> <ul> <li> a timely response to a request by the Department of Homeland Security for information about an alien in custody, including the alien's estimated release date; or </li> <li> compliance with a detainer request.</li> </ul>",0
118-hr141,hr,No Pay for Disarray Act,"Referred to the Committee on House Administration, and in addition to the Committee on Oversight and Accountability, for a period to be subsequently determined by the Speaker, in each case for consideration of such provisions as fall within the jurisdiction of the committee concerned.", <p><b>No Pay for Disarray Act</b></p> <p>This bill eliminates one day of pay for each Member of the House of Representatives for any day of a Congress during which no Speaker has been elected.</p>,3
118-hr160,hr,SALT Fairness Act of 2023,Referred to the House Committee on Ways and Means., <p><b>SALT Fairness Act of 2023</b></p> <p>This bill repeals the temporary restrictions in taxable years 2018 through 2025 on the deductibility of state and local taxes.</p>,2
118-hr161,hr,Prioritizing Troops Over Tax Collectors Act of 2023,"Referred to the Committee on Ways and Means, and in addition to the Committee on Armed Services, for a period to be subsequently determined by the Speaker, in each case for consideration of such provisions as fall within the jurisdiction of the committee concerned."," <p> <strong>Prioritizing Troops Over Tax Collectors Act of 2023</strong></p> <p>This bill establishes the rate of basic pay for a member of the uniformed services at the minimum amount of $31,200. It transfers unobligated amounts made available to the Internal Revenue Service (IRS) by the Inflation Reduction Act of 2022 for enforcement activities to pay for the increase in basic pay.</p> <p>The bill also prohibits the IRS from hiring additional employees until the increase in the rate of basic pay is implemented.</p>",2
118-hr193,hr,TRADES Act,Referred to the House Committee on Education and the Workforce.," <p><strong>Teach Relevant Apprenticeships to Drive Economic Success Act or the TRADES Act</strong></p> <p>This bill provides statutory authority for federal regulations titled <i>Apprenticeship Programs, Labor Standards for Registration, Amendment of Regulations</i>, originally published by the Department of Labor on March 11, 2020, and later rescinded on November 25, 2022.</p> <p>The rules permit the Department of Labor's Office of Apprenticeship to recognize qualified third-party entities, known as Standards Recognition Entities (SREs), which then evaluate and recognize Industry-Recognized Apprenticeship Programs (IRAPs).</p>",0
118-hr201,hr,Voluntary School Prayer Protection Act of 2023,Referred to the House Committee on Education and the Workforce.," <p><b>Voluntary School Prayer Protection Act of 2023</b></p> <p>This bill prohibits the Department of Education (ED) from providing funding for public schools that restrict voluntary school prayer.</p> <p>Specifically, the bill prohibits ED from providing funds to state or local educational agencies with policies that deny, or effectively prevent, individuals from voluntarily participating in public school prayer that is constitutionally protected.</p>",0
118-hr202,hr,States’ Education Reclamation Act of 2023,Referred to the House Committee on Education and the Workforce.," <p><b>States' Education Reclamation Act of </b><strong></strong><b>2023</b></p> <p>This bill abolishes the Department of Education (ED) and repeals any program for which it has administrative responsibility.</p> <p>The Department of the Treasury shall provide grants to states, for FY2023-FY2031, for elementary, secondary, and postsecondary education purposes permitted by state law. The level of funding is set at the amount provided to states for federal elementary and secondary education programs and the amount provided for federal postsecondary education programs, respectively, for FY2023, minus the funding provided for education programs that the bill transfers to other federal agencies. </p> <p>States must contract for an annual audit of their expenditures or transfers of grant funds.</p> <p>Program administrative responsibility and delegation of authority are transferred as follows:</p> <ul> <li>ED's job training programs to the Department of Labor,</li> <li>each special education grant program under the Individuals with Disabilities Education Act to the Department of Health and Human Services (HHS),</li> <li>ED's Indian education programs to the Department of the Interior,</li> <li>each Impact Aid program under the Elementary and Secondary Education Act of 1965 to the Department of Defense,</li> <li>the Federal Pell Grant program and each federal student loan program to Treasury, and </li> <li>programs under the jurisdiction of the Institute of Education Sciences or the D.C. Opportunity Scholarship Program to HHS.</li> </ul>",0
118-hr203,hr,No Hires for the Delinquent IRS Act,Referred to the House Committee on Ways and Means.," <p> <strong>No Hires for the Delinquent IRS Act </strong></p> <p>This bill prohibits the hiring of additional Internal Revenue Service (IRS) employees until the Department of the Treasury publicly issues a written certification that the IRS does not employ any individual who has a seriously delinquent tax debt (i.e., an outstanding tax debt for which a notice of lien has been filed in public records).</p>",2
118-hr221,hr,PROPEL Act,Referred to the House Committee on Education and the Workforce.," <p><b>Professional Pell Education Learning Act or the PROPEL Act</b></p> <p>This bill expands student eligibility for Pell Grants by allowing students to use these grants for enrollment in educational programs that consist of vocational or technical training, flight training, apprenticeship, or other on-job training. In addition, the bill expands institutional eligibility under the Federal Pell Grant program, including by allowing these vocational and training programs to be unaccredited.</p>",0
118-hconres6,hconres,Reclaiming Congress’s Constitutional Mandate in Trade Resolution,"Referred to the Committee on Rules, and in addition to the Committee on Ways and Means, for a period to be subsequently determined by the Speaker, in each case for consideration of such provisions as fall within the jurisdiction of the committee concerned."," <p><b>Reclaiming Congress's Constitutional Mandate in Trade Resolution</b></p> <p>This concurrent resolution establishes (1) a Joint Ad Hoc Committee on Trade Responsibilities to develop a plan under which the functions and responsibilities of the Office of the United States Trade Representative (USTR) shall be moved to the legislative branch, and (2) a Congressional Advisory Board on Trade Responsibilities to advise the committee in its development of the plan.</p> <p>The USTR and the other heads of executive branch offices must make available to the committee and the board such information and assistance as the entities may reasonably require to carry out their activities.</p>",3
118-hres8,hres,"Impeaching Alejandro Nicholas Mayorkas, Secretary of Homeland Security, for high crimes and misdemeanors.",Referred to the House Committee on the Judiciary.," <p>This resolution impeaches Alejandro Mayorkas, Secretary of Homeland Security, for high crimes and misdemeanors.</p>",1
118-hres13,hres,Stay on Schedule (S.O.S.) Resolution,Referred to the House Committee on Rules., <p><b>Stay on Schedule (S.O.S.) Resolution</b></p> <p>This resolution makes it out of order for the House to consider a concurrent resolution for its adjournment during any day in August of a calendar year unless it has passed by July 31 each of the regular appropriation bills for the fiscal year beginning on October 1.</p>,3
118-hr43,hr,Rural Broadband Window of Opportunity Act,Referred to the House Committee on Energy and Commerce.," <p><b>Rural Broadband Window of Opportunity Act</b></p> <p>This bill requires the Federal Communications Commission to prioritize the processing of applications for certain rural broadband expansion projects that are located in areas with the shortest construction seasons (e.g., areas with long winters and heavy snowfall).</p>",0
118-hr67,hr,Small Business Flexibility Act,Referred to the House Committee on Education and the Workforce.,"<p><strong>Small Business Flexibility Act</strong></p><p>This bill provides statutory authority for the pooling of tips among two pools of employees. The first pool consists of employees who customarily and regularly receive tips (as is permitted under the current statute). The second pool consists of (1) employees who customarily and regularly receive tips and are paid at least minimum wage, and (2) employees who do not customarily and regularly receive tips. &nbsp;</p>",2
118-hr69,hr,NOSHA Act,Referred to the House Committee on Education and the Workforce.," <p><strong>Nullify Occupational Safety and Health Administration Act or the NOSHA Act</strong></p> <p>This bill abolishes the Occupational Safety and Health Administration (OSHA). OSHA, which is part of the Department of Labor, sets and enforces workplace safety and health standards and provides related training, outreach, education, and assistance.</p>",0
118-hr72,hr,"To prohibit the use of Federal funds to maintain or collect information that can be used to identify any individual to whom a COVID-19 vaccine is administered, and for other purposes.",Referred to the House Committee on Energy and Commerce.," <p>This bill prohibits the use of federal funds to maintain a database or collect information that can be used to identify an individual's COVID-19 (i.e., coronavirus disease 2019) vaccination status.</p>",0
118-hr73,hr,No Pro-Abortion Task Force Act,Referred to the House Committee on Energy and Commerce.," <p><strong>No Pro-Abortion Task Force Act</strong></p> <p>This bill prohibits federal funding of the Reproductive Healthcare Access Task Force.</p> <p>The Department of Health and Human Services launched the task force on January 21, 2022, to identify and coordinate departmental activities related to accessing sexual and reproductive health care.</p>",0
